{
 "reviewed": "2026-10-22",
 "rule": "a PI is a faculty member of a computing department (Princeton CS; CMU's seven SCS departments; MIT EECS, CS+AI side; EPFL IC; Berkeley EECS, CS division) with stated PhD advising in 2016-2026 or a lab they head. Centres, initiatives and multi-PI groups are not labs. EPFL MERs count when they head their own lab or are stated PhD thesis directors.",
 "captures": "hierarchy/missing-pi-captures.sqlite (fetched or copied pages; quotes are exact substrings of the stored text, whitespace collapsed)",
 "tools": "hierarchy/missing-pi-tools/{mpcap.py,build_review.py}",
 "decisions": [
  {
   "name": "John Tsitsiklis",
   "decision": "qualifies",
   "added_to": "census/mit-additions.json",
   "summary": "EECS faculty [AI+D] listed every year 2016-2026; stated PhD advising in the window: co-adviser of the EECS Ph.D. theses of Kimon Drakopoulos (2016) and Martín Zubeldía Suárez (2019). The census had is_pi False only because its DSpace snapshot found none of his theses. His LIDS directorship is a multi-PI lab, so his own lab is a new \"John Tsitsiklis group\". The listings cover every year, so no reviewed period is needed.",
   "evidence": [
    {
     "handle": "1721.1/105663",
     "student": "Kimon Drakopoulos",
     "year": 2016,
     "url": "https://dspace.mit.edu/server/api/core/items/fb617a5f-584f-42e0-aca6-f5c7e5048da9",
     "sha256": "4d6e3562bdf984e1483444a7aa417a82bbbba00b7314f991fc067213dd3cfe56",
     "quote_advisor": "\"dc.contributor.advisor\" : [ { \"value\" : \"Asuman Ozdaglar and John N. Tsitsiklis.\"",
     "quote_degree": "Thesis: Ph. D., Massachusetts Institute of Technology, Department of Electrical Engineering and Computer Science, 2016."
    },
    {
     "handle": "1721.1/124124",
     "student": "Martín Zubeldía Suárez",
     "year": 2019,
     "url": "https://dspace.mit.edu/server/api/core/items/8a7b0ddb-a230-44b5-805e-f245a8818bd9",
     "sha256": "64002a2b91442262819e98217661ad27d4320dbba293b9fe917d556692a74269",
     "quote_advisor": "\"dc.contributor.advisor\" : [ { \"value\" : \"David Gamarnik and John N. Tsitsiklis.\"",
     "quote_degree": "Thesis: Ph. D., Massachusetts Institute of Technology, Department of Electrical Engineering and Computer Science, 2019"
    }
   ]
  },
  {
   "name": "Matei Zaharia",
   "aliases": [
    "Matei A. Zaharia"
   ],
   "decision": "does_not_qualify",
   "reason": "no_phd_advising_and_no_own_lab_in_window",
   "summary": "An MIT EECS assistant professor only until 2016 (listed 2016-01, gone by 2017-05; Stanford from 2016). His MIT advising in the window is five 2016 M.Eng. theses; no MIT Ph.D. thesis 2016-2026 names him, and no capture shows a lab he headed at MIT. Master's-only advising does not make a PI. (He is now Berkeley EECS faculty, which is the Berkeley census's concern, not MIT's.)",
   "thesis_harvest": {
    "theses": 5,
    "years": "2016",
    "roles": "masters (M.Eng.) only",
    "source": "hierarchy/thesis-harvest-report.json (non_pi_advisers); records in hierarchy/<school>/thesis-captures.sqlite"
   },
   "evidence": [
    {
     "url": "https://web.archive.org/web/20160104094659id_/http://www.eecs.mit.edu/people/faculty-advisors",
     "sha256": "1db54e06dcfbbbf9e13f0a1fe57d134f61ec37314ca8a64e870a3257861acca8",
     "quote": "Matei Zaharia Douglas Ross (1954) Career Development Professor of Software Technology",
     "observed": "2016-01-04",
     "kind": "dept_listing:EECS",
     "capture_copied_from": "claude-mit-20261020/raw/pages_people.sqlite"
    },
    {
     "url": "https://web.archive.org/web/20170507163814id_/http://www.eecs.mit.edu/people/faculty-advisors",
     "sha256": "0c3abc54f36d067cc7d80e7be88753794b5eea4b0f418702cd8ae8dd0f868a8e",
     "absent": "Zaharia",
     "observed": "2017-05-07",
     "kind": "dept_listing:EECS",
     "note": "not on the EECS faculty list by 2017-05-07"
    },
    {
     "url": "https://dspace.mit.edu/server/api/core/items/93dba851-bc4c-469d-baf5-68f68c90f859",
     "sha256": "57b79b4a102248cc2bfecfcc5d08e98b64ba52c5f56c35ccf316a5f53945f2f6",
     "quote": "\"dc.contributor.advisor\" : [ { \"value\" : \"Matei Zaharia.\"",
     "observed": "2026-10-22",
     "kind": "dspace_thesis"
    },
    {
     "url": "https://dspace.mit.edu/server/api/core/items/93dba851-bc4c-469d-baf5-68f68c90f859",
     "sha256": "57b79b4a102248cc2bfecfcc5d08e98b64ba52c5f56c35ccf316a5f53945f2f6",
     "quote": "Thesis: M. Eng., Massachusetts Institute of Technology, Department of Electrical Engineering and Computer Science, 2016.",
     "observed": "2026-10-22",
     "kind": "dspace_thesis"
    },
    {
     "url": "https://en.wikipedia.org/wiki/Matei_Zaharia",
     "sha256": "f5492dfcaf573fc561e2224f755b92d8ea6f9563d5ec99fa47d6d2353eccc104",
     "quote": "He joined the faculty of MIT in 2015, and then became an assistant professor of computer science at Stanford University in 2016.",
     "observed": "2026-10-22",
     "kind": "encyclopedia",
     "note": "secondary source; consistent with the listings"
    }
   ]
  },
  {
   "name": "Iddo Drori",
   "aliases": [],
   "decision": "does_not_qualify",
   "reason": "teaching_only",
   "summary": "every department listing 2016-2026 names this person only with a teaching title (Lecturer, Instructor, Teaching, of the Practice): teaching faculty, not a PI. Titles listed: Lecturer, [AI&D and CS]; listing years 2021-2022.",
   "evidence": [
    {
     "capture_url": "https://web.archive.org/web/20211021165900id_/https://www.eecs.mit.edu/role/lecturers/",
     "sha256": "adbdcfc6954b2cbbf7f96ff003bb6db8e0d51afefcd6aadf89124595095ce883",
     "quote": "Iddo Drori Lecturer, [AI&D and CS]"
    }
   ],
   "decided_by": "title rule (chain audit 2026-10-28)"
  },
  {
   "name": "Yonina Eldar",
   "aliases": [],
   "decision": "does_not_qualify",
   "reason": "visiting_only",
   "summary": "every department listing 2016-2026 names this person only with a Visiting title: a visitor, not a PI at the school. Titles listed: Visiting Professor; listing years 2022-2022.",
   "evidence": [
    {
     "capture_url": "https://web.archive.org/web/20220416104408id_/https://www.eecs.mit.edu/role/faculty/",
     "sha256": "ea290670e5281fb704e5b133b275b7afa14df6369001373cdb2a1504b2c09c91",
     "quote": "Yonina Eldar Visiting Professor"
    }
   ],
   "decided_by": "title rule (chain audit 2026-10-28)"
  },
  {
   "name": "Kyle Keane",
   "aliases": [],
   "decision": "does_not_qualify",
   "reason": "teaching_only",
   "summary": "every department listing 2016-2026 names this person only with a teaching title (Lecturer, Instructor, Teaching, of the Practice): teaching faculty, not a PI. Titles listed: Lecturer, [CS]; listing years 2023-2024.",
   "evidence": [
    {
     "capture_url": "https://web.archive.org/web/20230328024840id_/https://www.eecs.mit.edu/role/lecturers/",
     "sha256": "39b16addfce19635da9e248fbbdd138bacab8f947cc6eb102491c1f92a04d451",
     "quote": "Kyle Keane Lecturer, [CS]"
    }
   ],
   "decided_by": "title rule (chain audit 2026-10-28)"
  },
  {
   "name": "Mildred Dresselhaus",
   "aliases": [],
   "decision": "does_not_qualify",
   "reason": "emeritus_only",
   "summary": "every department listing 2016-2026 names this person only as Emeritus: retired throughout the window, so not counted as a PI (no advising evidence on record). Titles listed: Professor of Electrical Engineering and Physics Emerita, Institute Pro; listing years 2016-2016.",
   "evidence": [
    {
     "capture_url": "https://web.archive.org/web/20160326173633id_/http://www.eecs.mit.edu:80/people/faculty-advisors",
     "sha256": "53cd78af4a1a7cdda75d242f3a0ccc3c4fae8fa6c76fd34792c741255ca18e4f",
     "quote": "Mildred Dresselhaus Professor of Electrical Engineering and Physics Emerita, Institute Professor"
    }
   ],
   "decided_by": "title rule (chain audit 2026-10-28)"
  },
  {
   "name": "Haonan Chen",
   "aliases": [],
   "decision": "does_not_qualify",
   "reason": "visiting_only",
   "summary": "every department listing 2016-2026 names this person only with a Visiting title: a visitor, not a PI at the school. Titles listed: Visiting Scientist (Researchers); listing years 2026-2026.",
   "evidence": [
    {
     "capture_url": "https://web.archive.org/web/20260917151324id_/https://www.csail.mit.edu/api-proxy/angular-solr?_api_proxy_uri=people&q=*%3A*&rows=216&start=0&fq%5B%5D=ss_name%3A%22Principal%20Investigators%22%20OR%20ss_name%3A%22Researchers%22%20OR%20ss_name%3A%22Principal%20Investigators%22%20OR%20ss_name%3A%22Core%2FDual%22%20OR%20ss_name%3A%22Associates%22%20OR%20ss_name%3A%22Emeritus%22",
     "sha256": "13f3b4e313cd4e4e3ba7bc0747214b5a0ed91653196f0d3ccbe5eb8cbfd2a3cb",
     "quote": "Haonan Chen Visiting Scientist (Researchers)"
    }
   ],
   "decided_by": "title rule (chain audit 2026-10-28)"
  },
  {
   "name": "Shivam Nadimpalli",
   "aliases": [],
   "decision": "does_not_qualify",
   "reason": "teaching_only",
   "summary": "every department listing 2016-2026 names this person only with a teaching title (Lecturer, Instructor, Teaching, of the Practice): teaching faculty, not a PI. Titles listed: Instructor (Researchers); listing years 2026-2026.",
   "evidence": [
    {
     "capture_url": "https://web.archive.org/web/20260917151324id_/https://www.csail.mit.edu/api-proxy/angular-solr?_api_proxy_uri=people&q=*%3A*&rows=216&start=0&fq%5B%5D=ss_name%3A%22Principal%20Investigators%22%20OR%20ss_name%3A%22Researchers%22%20OR%20ss_name%3A%22Principal%20Investigators%22%20OR%20ss_name%3A%22Core%2FDual%22%20OR%20ss_name%3A%22Associates%22%20OR%20ss_name%3A%22Emeritus%22",
     "sha256": "13f3b4e313cd4e4e3ba7bc0747214b5a0ed91653196f0d3ccbe5eb8cbfd2a3cb",
     "quote": "Shivam Nadimpalli Instructor (Researchers)"
    }
   ],
   "decided_by": "title rule (chain audit 2026-10-28)"
  },
  {
   "name": "Ronald Parker",
   "aliases": [],
   "decision": "does_not_qualify",
   "reason": "emeritus_only",